name,location,description,capacity,price,dateOpened
Wildlife Wonderland,Zooville,Embark on an exciting journey to explore the diverse wonders of wildlife in a captivating setting.,1000,35.99,2005-08-12
Safari Spectacle,Savannah City,Immerse yourself in the heart of the savannah with our Safari Spectacle. Witness the majesty of wild animals roaming freely in their natural habitat.,800,42.50,2010-04-25
Ocean Odyssey,Aquatica Bay,Dive deep into the Ocean Odyssey and unravel the mysteries of marine life. Experience the awe-inspiring beauty of underwater creatures in a spectacular aquatic environment.,1200,39.99,2008-11-30
Sky High Zoo,Mountain Peaks,Take a soaring adventure at Sky High Zoo where you'll encounter exotic birds and mountain wildlife amidst breathtaking mountain peaks. An experience for nature enthusiasts!,600,29.99,2013-06-18
Jungle Junction,Tropical Forest,Embark on a thrilling expedition into the heart of the jungle at Jungle Junction. Discover the secrets of tropical flora and fauna in an immersive and enchanting environment.,1500,45.00,2007-09-05